title,location,post_date,link
PNB Recruitment of Local Bank Officer in JMGS I 03-Nov-25 23-Nov-25,,05-Nov-25,https://ibpsreg.ibps.in/pnboct25/
AIIMS Recruitment to Various Non-faculty Posts 01-Nov-25 30-Nov-25,,05-Nov-25,https://ibpsreg.ibps.in/aiimsgoct25/
SEBI Recruitment of Officer Grade A (Assistant Manager) 2025 30-Oct-25 28-Nov-25,,05-Nov-25,https://ibpsreg.ibps.in/sebisep25/
MEDA Recruitment of Various Posts 29-Oct-25 18-Nov-25,,05-Nov-25,https://ibpsreg.ibps.in/medasep25/
MSCEP Recruitment of Cluster Resource Center Co-ordinator (Cluster Head) 25-Oct-25 10-Nov-25,,05-Nov-25,https://ibpsreg.ibps.in/mscepoct25/
DCCB Recruitment of Staff Assistant 18-Oct-25 06-Nov-25,,05-Nov-25,https://ibpsreg.ibps.in/dccbsep25/
MOIL Recruitment of Various Posts 17-Oct-25 06-Nov-25,,05-Nov-25,https://ibpsreg.ibps.in/moilsep25/
CWC Recruitment of Various Posts 17-Oct-25 15-Nov-25,,05-Nov-25,https://ibpsreg.ibps.in/cwcsep25/
RECRUITMENT EXAMS,,,https://www.ibps.in/index.php/recruitment/
"Personnel Selection Services for Recruitment, Promotion and Placement",,,https://www.ibps.in/index.php/services
